{
  "diagramType": "use-case",
  "title": "GraduationProject — Use Case Diagram",
  "generatedAt": "2026-06-02",
  "groups": [
    { "id": "actors", "label": "Actors", "kind": "subsystem" },
    { "id": "browse", "label": "Public / Browse", "kind": "subsystem" },
    { "id": "learn", "label": "Learning (Student)", "kind": "subsystem" },
    { "id": "teach", "label": "Teaching (Instructor)", "kind": "subsystem" },
    { "id": "govern", "label": "Administration (Admin)", "kind": "subsystem" }
  ],
  "nodes": [
    { "id": "guest", "label": "User / Guest", "type": "actor", "group": "actors", "meta": { "role": "unauthenticated" } },
    { "id": "student", "label": "Student", "type": "actor", "group": "actors", "meta": { "role": "STUDENT" } },
    { "id": "instructor", "label": "Instructor (Lecturer)", "type": "actor", "group": "actors", "meta": { "role": "LECTURER" } },
    { "id": "admin", "label": "Admin", "type": "actor", "group": "actors", "meta": { "role": "ADMIN" } },

    { "id": "uc_register", "label": "Register / Login / Google OAuth", "type": "usecase", "group": "browse" },
    { "id": "uc_forgot", "label": "Forgot password (OTP)", "type": "usecase", "group": "browse" },
    { "id": "uc_browse", "label": "Browse & search courses", "type": "usecase", "group": "browse" },
    { "id": "uc_viewcourse", "label": "View course detail", "type": "usecase", "group": "browse" },
    { "id": "uc_trending", "label": "View trending feed", "type": "usecase", "group": "browse" },
    { "id": "uc_roadmap", "label": "View roadmaps", "type": "usecase", "group": "browse" },
    { "id": "uc_instrstats", "label": "View instructor stats", "type": "usecase", "group": "browse" },

    { "id": "uc_cart", "label": "Manage cart / wishlist", "type": "usecase", "group": "learn" },
    { "id": "uc_checkout", "label": "Checkout & pay", "type": "usecase", "group": "learn" },
    { "id": "uc_pay", "label": "Process payment (PayOS)", "type": "usecase", "group": "learn" },
    { "id": "uc_enroll", "label": "Enroll in course", "type": "usecase", "group": "learn" },
    { "id": "uc_learn", "label": "Learn lessons / track progress", "type": "usecase", "group": "learn" },
    { "id": "uc_quiz", "label": "Take quiz / submit attempt", "type": "usecase", "group": "learn" },
    { "id": "uc_feedback", "label": "Rate & review course", "type": "usecase", "group": "learn" },
    { "id": "uc_react", "label": "React to feedback", "type": "usecase", "group": "learn" },
    { "id": "uc_discuss", "label": "Post / upvote discussion", "type": "usecase", "group": "learn" },
    { "id": "uc_feedint", "label": "Like / save / comment feed", "type": "usecase", "group": "learn" },
    { "id": "uc_follow", "label": "Follow instructor", "type": "usecase", "group": "learn" },
    { "id": "uc_report", "label": "Report content", "type": "usecase", "group": "learn" },
    { "id": "uc_upgrade", "label": "Request lecturer upgrade", "type": "usecase", "group": "learn" },
    { "id": "uc_notif", "label": "View notifications", "type": "usecase", "group": "learn" },

    { "id": "uc_course", "label": "Create / edit course", "type": "usecase", "group": "teach" },
    { "id": "uc_submit", "label": "Submit course for review", "type": "usecase", "group": "teach" },
    { "id": "uc_lesson", "label": "Manage lessons / activities", "type": "usecase", "group": "teach" },
    { "id": "uc_makequiz", "label": "Create quiz (manual / AI)", "type": "usecase", "group": "teach" },
    { "id": "uc_video", "label": "Upload video (Bunny)", "type": "usecase", "group": "teach" },
    { "id": "uc_mascot", "label": "Manage mascot / edit projects", "type": "usecase", "group": "teach" },
    { "id": "uc_feedpost", "label": "Publish highlight feed", "type": "usecase", "group": "teach" },
    { "id": "uc_best", "label": "Mark best answer", "type": "usecase", "group": "teach" },
    { "id": "uc_roadmapmgmt", "label": "Manage roadmaps", "type": "usecase", "group": "teach" },
    { "id": "uc_analytics", "label": "View course / feed stats", "type": "usecase", "group": "teach" },
    { "id": "uc_revenue", "label": "View revenue dashboard", "type": "usecase", "group": "teach" },

    { "id": "uc_review", "label": "Review course (approve / reject)", "type": "usecase", "group": "govern" },
    { "id": "uc_publish", "label": "Publish course", "type": "usecase", "group": "govern" },
    { "id": "uc_ban", "label": "Ban / delete course", "type": "usecase", "group": "govern" },
    { "id": "uc_reports", "label": "Review reports", "type": "usecase", "group": "govern" },
    { "id": "uc_users", "label": "Manage users / reset", "type": "usecase", "group": "govern" },
    { "id": "uc_reviewupgrade", "label": "Review lecturer requests", "type": "usecase", "group": "govern" },
    { "id": "uc_modfeedback", "label": "Moderate feedback", "type": "usecase", "group": "govern" },
    { "id": "uc_audit", "label": "View audit logs", "type": "usecase", "group": "govern" },
    { "id": "uc_issuetoken", "label": "Issue admin token", "type": "usecase", "group": "govern" }
  ],
  "edges": [
    { "from": "student", "to": "guest", "type": "generalization", "label": "inherits" },
    { "from": "instructor", "to": "student", "type": "generalization", "label": "inherits" },

    { "from": "guest", "to": "uc_register", "type": "association" },
    { "from": "guest", "to": "uc_forgot", "type": "association" },
    { "from": "guest", "to": "uc_browse", "type": "association" },
    { "from": "guest", "to": "uc_viewcourse", "type": "association" },
    { "from": "guest", "to": "uc_trending", "type": "association" },
    { "from": "guest", "to": "uc_roadmap", "type": "association" },
    { "from": "guest", "to": "uc_instrstats", "type": "association" },

    { "from": "student", "to": "uc_cart", "type": "association" },
    { "from": "student", "to": "uc_checkout", "type": "association" },
    { "from": "student", "to": "uc_enroll", "type": "association" },
    { "from": "student", "to": "uc_learn", "type": "association" },
    { "from": "student", "to": "uc_quiz", "type": "association" },
    { "from": "student", "to": "uc_feedback", "type": "association" },
    { "from": "student", "to": "uc_react", "type": "association" },
    { "from": "student", "to": "uc_discuss", "type": "association" },
    { "from": "student", "to": "uc_feedint", "type": "association" },
    { "from": "student", "to": "uc_follow", "type": "association" },
    { "from": "student", "to": "uc_report", "type": "association" },
    { "from": "student", "to": "uc_upgrade", "type": "association" },
    { "from": "student", "to": "uc_notif", "type": "association" },

    { "from": "instructor", "to": "uc_course", "type": "association" },
    { "from": "instructor", "to": "uc_submit", "type": "association" },
    { "from": "instructor", "to": "uc_lesson", "type": "association" },
    { "from": "instructor", "to": "uc_makequiz", "type": "association" },
    { "from": "instructor", "to": "uc_video", "type": "association" },
    { "from": "instructor", "to": "uc_mascot", "type": "association" },
    { "from": "instructor", "to": "uc_feedpost", "type": "association" },
    { "from": "instructor", "to": "uc_best", "type": "association" },
    { "from": "instructor", "to": "uc_roadmapmgmt", "type": "association" },
    { "from": "instructor", "to": "uc_analytics", "type": "association" },
    { "from": "instructor", "to": "uc_revenue", "type": "association" },

    { "from": "admin", "to": "uc_review", "type": "association" },
    { "from": "admin", "to": "uc_publish", "type": "association" },
    { "from": "admin", "to": "uc_ban", "type": "association" },
    { "from": "admin", "to": "uc_reports", "type": "association" },
    { "from": "admin", "to": "uc_users", "type": "association" },
    { "from": "admin", "to": "uc_reviewupgrade", "type": "association" },
    { "from": "admin", "to": "uc_modfeedback", "type": "association" },
    { "from": "admin", "to": "uc_audit", "type": "association" },
    { "from": "admin", "to": "uc_issuetoken", "type": "association" },
    { "from": "admin", "to": "uc_lesson", "type": "association" },
    { "from": "admin", "to": "uc_course", "type": "association" },

    { "from": "uc_checkout", "to": "uc_pay", "type": "include" },
    { "from": "uc_pay", "to": "uc_enroll", "type": "include" },
    { "from": "uc_makequiz", "to": "uc_video", "type": "extend" },
    { "from": "uc_upgrade", "to": "uc_reviewupgrade", "type": "extend" }
  ]
}
