{
  "diagramType": "logical-view",
  "title": "GraduationProject — Architecture Logical View",
  "generatedAt": "2026-06-02",
  "groups": [
    { "id": "presentation", "label": "Presentation Layer", "kind": "layer" },
    { "id": "edge", "label": "Edge / Gateway Layer", "kind": "layer" },
    { "id": "services", "label": "Application Service Layer", "kind": "layer" },
    { "id": "data", "label": "Data Layer", "kind": "layer" },
    { "id": "external", "label": "External Integrations", "kind": "layer" }
  ],
  "nodes": [
    { "id": "web", "label": "Next.js SPA (frontend-nextjs)", "type": "spa", "group": "presentation" },
    { "id": "gateway", "label": "API Gateway (Express)", "type": "gateway", "group": "edge",
      "meta": { "responsibilities": ["CORS", "rate-limit", "JWT verify", "access-policy RBAC", "x-user-* header inject", "HTTP + WebSocket proxy"] } },
    { "id": "auth_service", "label": "auth_service (NestJS)", "type": "service", "group": "services",
      "meta": { "responsibilities": ["register/login", "JWT issue/refresh", "Google OAuth", "forgot-password OTP"] } },
    { "id": "user_service", "label": "user_service (NestJS)", "type": "service", "group": "services",
      "meta": { "responsibilities": ["profile", "role management", "lecturer-upgrade requests", "instructor follows", "audit logs"] } },
    { "id": "course_service", "label": "course_service (NestJS)", "type": "service", "group": "services",
      "meta": { "responsibilities": ["courses", "lessons", "quizzes (+AI)", "submissions", "enroll", "lesson progress", "cart", "wishlist", "feedback", "discussions", "roadmaps", "reports"] } },
    { "id": "media_service", "label": "media_service (NestJS)", "type": "service", "group": "services",
      "meta": { "responsibilities": ["videos", "edit projects", "mascot images/overlays", "highlight feed", "comments/interactions/views", "notifications", "SSE/WebSocket"] } },
    { "id": "payment_service", "label": "payment_service (Express)", "type": "service", "group": "services",
      "meta": { "responsibilities": ["PayOS payment links", "webhook verification", "transactions", "Redis events"] } },
    { "id": "mail_service", "label": "mail_service", "type": "service", "group": "services",
      "meta": { "responsibilities": ["OTP email via Nodemailer"] } },
    { "id": "ai_service", "label": "ai_service", "type": "service", "group": "services",
      "meta": { "responsibilities": ["quiz-generation helpers/CLI"] } },
    { "id": "inference_service", "label": "inference_service", "type": "service", "group": "services",
      "meta": { "responsibilities": ["model inference"] } },
    { "id": "mysql", "label": "MySQL 8 (graduation_db)", "type": "database", "group": "data",
      "meta": { "note": "single shared DB; per-service Sequelize models" } },
    { "id": "redis", "label": "Redis 7", "type": "cache", "group": "data",
      "meta": { "uses": ["refresh-token cache", "OTP store", "payment pub/sub", "feed recommendation cache"] } },
    { "id": "bunny", "label": "Bunny Stream", "type": "external", "group": "external", "meta": { "role": "video CDN" } },
    { "id": "cloudinary", "label": "Cloudinary", "type": "external", "group": "external", "meta": { "role": "image CDN" } },
    { "id": "payos", "label": "PayOS", "type": "external", "group": "external", "meta": { "role": "payment gateway" } },
    { "id": "openai", "label": "OpenAI API", "type": "external", "group": "external", "meta": { "role": "quiz generation" } },
    { "id": "smtp", "label": "Gmail SMTP", "type": "external", "group": "external", "meta": { "role": "email delivery" } },
    { "id": "deploy_model", "label": "deploy-model", "type": "external", "group": "external", "meta": { "role": "mascot talking-head generation" } }
  ],
  "edges": [
    { "from": "web", "to": "gateway", "type": "rest", "label": "REST + Socket.IO + SSE (Bearer token)" },
    { "from": "gateway", "to": "auth_service", "type": "rest", "label": "proxy /api/auth" },
    { "from": "gateway", "to": "user_service", "type": "rest", "label": "proxy /api/users" },
    { "from": "gateway", "to": "course_service", "type": "rest", "label": "proxy /api/course" },
    { "from": "gateway", "to": "media_service", "type": "rest", "label": "proxy /api/media, /api/feed" },
    { "from": "gateway", "to": "payment_service", "type": "rest", "label": "proxy /api/payment" },
    { "from": "gateway", "to": "media_service", "type": "ws-sse", "label": "WS / SSE proxy" },
    { "from": "auth_service", "to": "mail_service", "type": "external-http", "label": "send OTP" },
    { "from": "course_service", "to": "ai_service", "type": "external-http", "label": "quiz generation" },
    { "from": "auth_service", "to": "mysql", "type": "db", "label": "Sequelize" },
    { "from": "user_service", "to": "mysql", "type": "db", "label": "Sequelize" },
    { "from": "course_service", "to": "mysql", "type": "db", "label": "Sequelize" },
    { "from": "media_service", "to": "mysql", "type": "db", "label": "Sequelize" },
    { "from": "payment_service", "to": "mysql", "type": "db", "label": "Sequelize" },
    { "from": "auth_service", "to": "redis", "type": "cache", "label": "refresh token / blacklist" },
    { "from": "mail_service", "to": "redis", "type": "cache", "label": "OTP store" },
    { "from": "media_service", "to": "redis", "type": "cache", "label": "feed reco cache" },
    { "from": "payment_service", "to": "redis", "type": "redis-pubsub", "label": "publish payment:success" },
    { "from": "redis", "to": "course_service", "type": "redis-pubsub", "label": "subscribe payment events" },
    { "from": "course_service", "to": "openai", "type": "external-http", "label": "quiz gen" },
    { "from": "ai_service", "to": "openai", "type": "external-http", "label": "completion" },
    { "from": "media_service", "to": "bunny", "type": "external-http", "label": "TUS upload + webhook" },
    { "from": "media_service", "to": "cloudinary", "type": "external-http", "label": "signed upload" },
    { "from": "media_service", "to": "deploy_model", "type": "external-http", "label": "job submit / webhook" },
    { "from": "payment_service", "to": "payos", "type": "external-http", "label": "create link + webhook verify" },
    { "from": "mail_service", "to": "smtp", "type": "external-http", "label": "nodemailer" }
  ]
}
